Week,Day,Platform,Content Type,Topic/Theme,Format,Time (ET),Status,Notes
1,Monday,LinkedIn,Long-form,Launch Announcement: SlideTheory Introduction,Article,9:00 AM,,"First post - establish credibility and mission"
1,Monday,Twitter,Single Tweet,LinkedIn post teaser with link,Text + Link,10:00 AM,,"Drive traffic to LinkedIn for algorithm boost"
1,Tuesday,Twitter,Thread,The 5 Frameworks Every Tech Leader Should Know,Thread (10-12 tweets),9:00 AM,,"High-value educational content"
1,Tuesday,TikTok,Video,3 Signs Your Data Strategy Is Broken,30-45 sec talking head,8:00 AM,,"Hook-focused, trending format"
1,Wednesday,LinkedIn,Insight Post,The #1 Mistake in Data Strategy (Tools Before Decisions),Text (2-3 paragraphs),9:00 AM,,"Contrarian take with clear argument"
1,Wednesday,Reddit,Comment,Engage on r/consulting - answer career question,Text response,7:00 PM,,"Build karma and credibility"
1,Thursday,Twitter,Single Tweet,Question: What's the most expensive consulting mistake you've seen?,Poll + Text,2:00 PM,,"Engagement-driven"
1,Thursday,LinkedIn,Engagement Post,Same question as Twitter (adapted),Text,3:00 PM,,"Cross-platform consistency"
1,Friday,Twitter,Thread,Lessons from Migrating a 10TB Data Warehouse,Thread (8-10 tweets),9:00 AM,,"Case study format"
1,Friday,LinkedIn,Single Post,Weekend reading: Summary of week's content,Text + Links,4:00 PM,,"Aggregate and drive to longer content"
1,Saturday,TikTok,Video,POV: You Just Realized the Framework Changes Everything,Trending sound + text,10:00 AM,,"Trend participation"
1,Sunday,-,Planning,Content planning for Week 2,Planning,-,,"Review analytics, plan next week"
2,Monday,LinkedIn,Article,The Decision Triangle Framework: Speed vs Quality vs Cost,Article,9:00 AM,,"Framework deep-dive"
2,Monday,Twitter,Thread,Breakdown of Decision Triangle Framework,Thread (visual + text),10:00 AM,,"Visual content performs well"
2,Tuesday,Twitter,Single Tweet,Hot take: Most consultants are just expensive therapists,Text,9:00 AM,,"Controversial for engagement"
2,Tuesday,TikTok,Video,The Consulting Trick That Saves Every Project,45-60 sec story,8:00 AM,,"Story format"
2,Wednesday,LinkedIn,Insight Post,Why I Built SlideTheory (Origin Story),Personal narrative,9:00 AM,,"Vulnerability builds connection"
2,Wednesday,Reddit,Original Post,I built a framework for technology strategy after seeing it fail 3 times,Text post (r/consulting),7:00 PM,,"First original post - value only"
2,Thursday,YouTube,Video,The Framework I Use for Every Technology Decision,8-12 min,2:00 PM,,"First YouTube video"
2,Thursday,Twitter,Promotional,YouTube video announcement with key takeaway,Text + Link,3:00 PM,,"Cross-promotion"
2,Thursday,LinkedIn,Single Post,YouTube video announcement (different angle),Text + Link,4:00 PM,,"Platform-specific adaptation"
2,Friday,Twitter,Thread,5 Lessons from My First Consulting Engagement,Thread,9:00 AM,,"Personal experience"
2,Friday,LinkedIn,Engagement Post,Question: What's your go-to consulting framework?,Text,2:00 PM,,"Community building"
2,Saturday,TikTok,Video,Stop Doing This With Your Data Warehouse,45-60 sec educational,10:00 AM,,"Educational + actionable"
2,Sunday,-,Planning,Content planning for Week 3 + batch create,Planning,-,,"Batch creation session"
3,Monday,LinkedIn,Article,Building Data Systems That Scale: A Framework,Article,9:00 AM,,"Technical depth"
3,Monday,Twitter,Single Tweet,One thing I wish I knew before my first data migration,Text,10:00 AM,,"Relatable reflection"
3,Tuesday,Twitter,Thread,How to Structure Your First 90 Days as a Tech Consultant,Thread (12-15 tweets),9:00 AM,,"Practical guide"
3,Tuesday,TikTok,Video,Day in the Life of a Tech Consultant,60 sec behind-the-scenes,8:00 AM,,"Behind-the-scenes content"
3,Wednesday,LinkedIn,Insight Post,The Skills Gap Between Engineers and Tech Leaders,Opinion piece,9:00 AM,,"Thought leadership"
3,Wednesday,Reddit,Comment,Engage on r/dataengineering - technical architecture question,Detailed answer,7:00 PM,,"Technical credibility"
3,Thursday,YouTube,Video,Why Most Data Strategies Fail (And How to Fix Yours),10-15 min,2:00 PM,,"Problem/solution format"
3,Thursday,Twitter,Promotional,YouTube video announcement,Text + Link,3:00 PM,,""
3,Thursday,LinkedIn,Single Post,YouTube video - key insight extracted,Text + Link,4:00 PM,,""
3,Friday,Twitter,Single Tweet,Weekend thought: Frameworks are just documented intuition,Text,9:00 AM,,"Philosophical for engagement"
3,Friday,LinkedIn,Engagement Post,Weekend reflection + question about work-life balance,Text,3:00 PM,,"Personal connection"
3,Saturday,TikTok,Video,When the Client Asks for the Impossible,Trending sound + relatable scenario,10:00 AM,,"Humor + relatability"
3,Sunday,-,Planning,Review Month 1 analytics + Q2 planning,Planning,-,,"Strategic review"
4,Monday,LinkedIn,Article,The Consulting Engagement Lifecycle: From Discovery to Delivery,Comprehensive guide,9:00 AM,,"Evergreen content"
4,Monday,Twitter,Thread,Extract 10 key points from LinkedIn article,Thread,10:00 AM,,"Repurposing"
4,Tuesday,Twitter,Single Tweet,Unpopular opinion: You don't need more data. You need better questions.,Text,9:00 AM,,"Contrarian"
4,Tuesday,TikTok,Video,3 Questions to Ask Before Any Data Project,30-45 sec list,8:00 AM,,"Quick value"
4,Wednesday,LinkedIn,Insight Post,What I Learned from a Failed Consulting Project,Case study (failure),9:00 AM,,"Vulnerability + lessons"
4,Wednesday,Reddit,Comment,Engage on r/startups - scaling advice,Detailed response,7:00 PM,,"Founder perspective"
4,Thursday,YouTube,Video,5 Lessons from Migrating a Data Warehouse (Real Case Study),12-18 min,2:00 PM,,"Deep case study"
4,Thursday,Twitter,Promotional,YouTube case study announcement,Text + Link,3:00 PM,,""
4,Thursday,LinkedIn,Single Post,Case study summary with lessons learned,Text + Link,4:00 PM,,""
4,Friday,Twitter,Thread,How to Evaluate a Consulting Proposal (Red Flags and Green Flags),Thread,9:00 AM,,"Buyer-focused content"
4,Friday,LinkedIn,Engagement Post,Poll: What's your biggest challenge with data strategy?,Poll,2:00 PM,,"Market research + engagement"
4,Saturday,TikTok,Video,Consulting Red Flags 🚩,30 sec quick-hitting,10:00 AM,,"Entertaining + valuable"
4,Sunday,-,Planning,Month 2 content calendar + YouTube batch filming,Planning,-,,"Prep ahead"
5,Monday,LinkedIn,Article,Building a Data-Driven Culture: The Non-Technical Guide,Article,9:00 AM,,"Broader audience"
5,Monday,Twitter,Thread,10 Signs Your Company Isn't Actually Data-Driven,Thread,10:00 AM,,"List format (high engagement)"
5,Tuesday,Twitter,Single Tweet,The best consultants I know all share this one trait...,Text,9:00 AM,,"Curiosity gap"
5,Tuesday,TikTok,Video,When You Finally Find the Root Cause,Relatable scenario,8:00 AM,,"Relatable humor"
5,Wednesday,LinkedIn,Insight Post,The Hidden Cost of Technical Debt (Beyond Engineering),Business case,9:00 AM,,"C-suite focused"
5,Wednesday,Reddit,Comment,Engage on r/techlead - leadership question,Thoughtful answer,7:00 PM,,"Leadership angle"
5,Thursday,YouTube,Video,The Consulting Skill Nobody Teaches You,6-10 min,2:00 PM,,"Unique angle"
5,Thursday,Twitter,Promotional,YouTube video - consulting skills,Text + Link,3:00 PM,,""
5,Thursday,LinkedIn,Single Post,YouTube video with personal anecdote,Text + Link,4:00 PM,,""
5,Friday,Twitter,Thread,Framework: The 3-Question Decision Model,Thread with visual,9:00 AM,,"Reusable framework"
5,Friday,LinkedIn,Engagement Post,Friday reflection: What surprised you this week?,Text,3:00 PM,,"Community check-in"
5,Saturday,TikTok,Video,Things I Wish I Knew Before Becoming a Consultant,Story format,10:00 AM,,"Personal + valuable"
5,Sunday,-,Planning,Review + plan Week 6,Planning,-,,""
6,Monday,LinkedIn,Article,Strategic Planning for Technology Leaders: A Practical Framework,Article,9:00 AM,,"Strategic focus"
6,Monday,Twitter,Thread,The difference between strategy and planning (most people get this wrong),Thread,10:00 AM,,"Educational correction"
6,Tuesday,Twitter,Single Tweet,Your data team isn't slow. Your decision process is.,Text,9:00 AM,,"Reframing common complaint"
6,Tuesday,TikTok,Video,How to Present Data to Executives (Without Losing Them),Educational,8:00 AM,,"Communication skills"
6,Wednesday,LinkedIn,Insight Post,What Series B Startups Get Wrong About Data Infrastructure,Targeted insight,9:00 AM,,"Specific audience"
6,Wednesday,Reddit,Original Post,Lessons from building data platforms at 3 different startups (r/SaaS),Value post,7:00 PM,,"Founder-focused sub"
6,Thursday,YouTube,Video,How I Structure Technology Strategy Engagements,10-14 min,2:00 PM,,"Process reveal"
6,Thursday,Twitter,Promotional,YouTube process video,Text + Link,3:00 PM,,""
6,Thursday,LinkedIn,Single Post,Process post with invitation to discuss,Text + Link,4:00 PM,,"CTA for conversation"
6,Friday,Twitter,Thread,Consulting Toolkit: The 7 Tools I Use on Every Project,Thread,9:00 AM,,"Resource sharing"
6,Friday,LinkedIn,Engagement Post,Weekend question: What are you optimizing for right now?,Text,3:00 PM,,"Reflection"
6,Saturday,TikTok,Video,Consulting Tools Explained in 60 Seconds,Quick overview,10:00 AM,,"Information dense"
6,Sunday,-,Planning,Month 2 review + Q3 planning begins,Planning,-,,"Strategic review"
7,Monday,LinkedIn,Article,The ROI of Good Data Strategy: Measuring What Matters,Article,9:00 AM,,"ROI-focused (C-suite)"
7,Monday,Twitter,Single Tweet,Most data ROI calculations are wrong. Here's why.,Text,10:00 AM,,"Contrarian data take"
7,Tuesday,Twitter,Thread,How to Build a Data Team (Even If You're Not Technical),Thread,9:00 AM,,"Non-technical audience"
7,Tuesday,TikTok,Video,Data Team Roles Explained Like You're 5,Educational,8:00 AM,,"Simplification"
7,Wednesday,LinkedIn,Insight Post,The One Metric That Predicts Consulting Engagement Success,Insight piece,9:00 AM,,"Proprietary insight"
7,Wednesday,Reddit,Comment,Engage on r/consulting - career transition question,Supportive answer,7:00 PM,,"Community support"
7,Thursday,YouTube,Video,Deep Dive: The SlideTheory Framework in Action,15-20 min,2:00 PM,,"Brand methodology"
7,Thursday,Twitter,Promotional,Framework deep-dive video,Text + Link,3:00 PM,,""
7,Thursday,LinkedIn,Single Post,Framework methodology with invitation to connect,Text + Link,4:00 PM,,""
7,Friday,Twitter,Single Tweet,Month 1 recap: What I learned building in public,Text,9:00 AM,,"Transparency"
7,Friday,LinkedIn,Engagement Post,Month 1 reflection + thank you to community,Text,3:00 PM,,"Gratitude + engagement"
7,Saturday,TikTok,Video,Month 1 Behind the Scenes: What Actually Happened,BTS content,10:00 AM,,"Authenticity"
7,Sunday,-,Planning,Q3 content strategy + batch creation,Planning,-,,""
8,Monday,LinkedIn,Article,Advanced Topics: Multi-Cloud Data Strategy,Deep technical,9:00 AM,,"Advanced audience"
8,Monday,Twitter,Thread,The case against multi-cloud (and when to ignore it),Thread,10:00 AM,,"Debate-sparking"
8,Tuesday,Twitter,Single Tweet,Consulting isn't about having answers. It's about asking better questions.,Text,9:00 AM,,"Philosophy"
8,Tuesday,TikTok,Video,Questions That Changed My Consulting Career,Story format,8:00 AM,,"Narrative"
8,Wednesday,LinkedIn,Insight Post,Working with Difficult Stakeholders: A Consultant's Guide,Soft skills,9:00 AM,,"People-focused"
8,Wednesday,Reddit,Comment,Engage on r/ExperiencedDevs - architecture discussion,Technical depth,7:00 PM,,"Technical cred"
8,Thursday,YouTube,Video,Client Communication: What Works (And What Doesn't),10-12 min,2:00 PM,,"Soft skills video"
8,Thursday,Twitter,Promotional,Communication skills video,Text + Link,3:00 PM,,""
8,Thursday,LinkedIn,Single Post,Client communication tips extracted,Text + Link,4:00 PM,,""
8,Friday,Twitter,Thread,The Complete Tech Consultant Reading List,Resource thread,9:00 AM,,"Value-packed"
8,Friday,LinkedIn,Engagement Post,Book recommendations + ask for community favorites,Text,3:00 PM,,"Community building"
8,Saturday,TikTok,Video,Consulting Books That Actually Changed How I Work,Book review format,10:00 AM,,"Educational"
8,Sunday,-,Planning,Quarterly review + strategy adjustment,Planning,-,,"90-day checkpoint"
9,Monday,LinkedIn,Article,Preparing for Due Diligence: A Data Readiness Framework,Article,9:00 AM,,"Specific use case"
9,Monday,Twitter,Thread,Due diligence red flags investors actually care about,Thread,10:00 AM,,"Investor angle"
9,Tuesday,Twitter,Single Tweet,Your data room says more about your company than your pitch deck.,Text,9:00 AM,,"Insightful take"
9,Tuesday,TikTok,Video,How to Prepare for Investor Due Diligence,Educational,8:00 AM,,"Founder-focused"
9,Wednesday,LinkedIn,Insight Post,The Evolution of a Consultant: From Executor to Advisor,Career journey,9:00 AM,,"Career development"
9,Wednesday,Reddit,Comment,Engage on r/consulting - rate my resume type post,Constructive feedback,7:00 PM,,"Giving back"
9,Thursday,YouTube,Video,From Engineer to Consultant: My Career Transition Story,10-15 min,2:00 PM,,"Personal story"
9,Thursday,Twitter,Promotional,Career transition video,Text + Link,3:00 PM,,""
9,Thursday,LinkedIn,Single Post,Career story with lessons for others,Text + Link,4:00 PM,,""
9,Friday,Twitter,Thread,Signs You're Ready to Hire a Tech Consultant,Buyer education,9:00 AM,,"Sales-enablement"
9,Friday,LinkedIn,Engagement Post,When did you know it was time to get outside help?,Question,3:00 PM,,"Market research"
9,Saturday,TikTok,Video,Signs You Need a Consultant (VS Doing It Yourself),Educational,10:00 AM,,"Sales-supporting"
9,Sunday,-,Planning,Plan Week 10,Planning,-,,""
10,Monday,LinkedIn,Article,Building Your First Data Warehouse: A Startup Guide,Practical guide,9:00 AM,,"Starter-focused"
10,Monday,Twitter,Thread,Data warehouse mistakes that cost startups millions,Thread,10:00 AM,,"Fear + solution"
10,Tuesday,Twitter,Single Tweet,The cheapest data stack that actually scales.,Text,9:00 AM,,"Budget-conscious"
10,Tuesday,TikTok,Video,Cheap Data Stack That Actually Works,Tool showcase,8:00 AM,,"Tool-focused"
10,Wednesday,LinkedIn,Insight Post,Negotiating Consulting Engagements: A Client's Guide,Buyer education,9:00 AM,,"Transparent selling"
10,Wednesday,Reddit,Original Post,How to evaluate and hire data consultants (r/startups),Value post,7:00 PM,,"Service to community"
10,Thursday,YouTube,Video,Building a Data Warehouse from Scratch (Tutorial),15-20 min,2:00 PM,,"Tutorial format"
10,Thursday,Twitter,Promotional,Tutorial video announcement,Text + Link,3:00 PM,,""
10,Thursday,LinkedIn,Single Post,Tutorial with key takeaways,Text + Link,4:00 PM,,""
10,Friday,Twitter,Thread,10 Questions to Ask Before Hiring Any Consultant,Thread,9:00 AM,,"Buyer empowerment"
10,Friday,LinkedIn,Engagement Post,Weekend reflection + community appreciation,Text,3:00 PM,,"Relationship building"
10,Saturday,TikTok,Video,Before You Hire a Consultant... (Red Flags),Educational,10:00 AM,,"Warning format"
10,Sunday,-,Planning,Month 3 review + Q4 planning,Planning,-,,"Quarter close"
11,Monday,LinkedIn,Article,The Future of Data Engineering: Trends for 2025,Forward-looking,9:00 AM,,"Thought leadership"
11,Monday,Twitter,Thread,5 trends that will change data engineering (and 5 that won't),Thread,10:00 AM,,"Predictions"
11,Tuesday,Twitter,Single Tweet,AI won't replace data engineers. But data engineers who use AI will replace those who don't.,Text,9:00 AM,,"AI angle"
11,Tuesday,TikTok,Video,AI + Data Engineering: What Actually Changes?,Trending topic,8:00 AM,,"Timely content"
11,Wednesday,LinkedIn,Insight Post,Consulting in the Age of AI: What's Changing,Industry perspective,9:00 AM,,"Adaptation"
11,Wednesday,Reddit,Comment,Engage on r/dataengineering - AI tooling discussion,Technical opinion,7:00 PM,,"Current events"
11,Thursday,YouTube,Video,How AI is Changing Consulting (And My Practice),10-12 min,2:00 PM,,"Relevant topic"
11,Thursday,Twitter,Promotional,AI + consulting video,Text + Link,3:00 PM,,""
11,Thursday,LinkedIn,Single Post,AI thoughts with practical applications,Text + Link,4:00 PM,,""
11,Friday,Twitter,Thread,Resources for Staying Current in Tech Consulting,Resource thread,9:00 AM,,"Ongoing value"
11,Friday,LinkedIn,Engagement Post,How do you stay current in your field?,Question,3:00 PM,,"Engagement"
11,Saturday,TikTok,Video,How I Stay Current in Tech (My Actual Process),BTS/Process,10:00 AM,,"Authentic"
11,Sunday,-,Planning,Plan Week 12,Planning,-,,""
12,Monday,LinkedIn,Article,Year-End Review: What Worked (And What Didn't) in Data Strategy,Retrospective,9:00 AM,,"Seasonal content"
12,Monday,Twitter,Thread,The biggest data strategy wins and failures I saw this year,Thread,10:00 AM,,"Retrospective"
12,Tuesday,Twitter,Single Tweet,2025 prediction: The companies that win will be the ones that simplify fastest.,Text,9:00 AM,,"Prediction"
12,Tuesday,TikTok,Video,2025 Tech Predictions (Consultant's Perspective),Trending format,8:00 AM,,"Trending"
12,Wednesday,LinkedIn,Insight Post,Planning Your 2025 Data Strategy: A Framework,Planning guide,9:00 AM,,"Forward-looking"
12,Wednesday,Reddit,Comment,Engage on multiple subs - year-end discussions,Various,7:00 PM,,"Community participation"
12,Thursday,YouTube,Video,Year in Review: Consulting Lessons from 2024,12-15 min,2:00 PM,,"Annual content"
12,Thursday,Twitter,Promotional,Year review video,Text + Link,3:00 PM,,""
12,Thursday,LinkedIn,Single Post,Year review with personal reflections,Text + Link,4:00 PM,,""
12,Friday,Twitter,Thread,Goals for 2025: Building SlideTheory in Public,Transparency thread,9:00 AM,,"Forward-looking"
12,Friday,LinkedIn,Engagement Post,What are your professional goals for 2025?,Question,3:00 PM,,"Community engagement"
12,Saturday,TikTok,Video,My 2025 Goals (Building in Public),Personal,10:00 AM,,"Authentic planning"
12,Sunday,-,Planning,Full year review + 2025 strategy,Planning,-,,"Annual planning"
